{
  "schema_version": "fightbox.fixture.s6a.v1",
  "fixture_id": "chicago-walk",
  "gate": "S5",
  "coordinate_frame": {
    "name": "local_enu",
    "units": "meters_seconds",
    "axes": "x_east_y_north_z_up",
    "steam_audio_mapping": "steam_x=enu_x;steam_y=enu_z;steam_z=-enu_y"
  },
  "kernel": {
    "name": "Steam Audio",
    "version": "4.8.1"
  },
  "sources": [
    {
      "id": "toms-diner-storefront",
      "asset_id": "toms-diner",
      "reference_level": {
        "mode": "SplAtOneMeter",
        "db_spl": 85
      },
      "position_m": [12.5, -12.0, 1.5]
    }
  ],
  "listener": {
    "trajectory": {
      "waypoints_m": [
        [15.5, -55.0, 1.5],
        [15.5, 1.0, 1.5],
        [-13.5, 1.0, 1.5]
      ],
      "speed_mps": 1.4,
      "max_speed_mps": 2.0
    },
    "forward_enu": [0, 1, 0],
    "up_enu": [0, 0, 1]
  },
  "geometry": {
    "vertices_m": [
      [-20, -85, 0],
      [20, -85, 0],
      [20, 155, 0],
      [-20, 155, 0]
    ],
    "triangles": [
      {"indices": [0, 1, 2], "material": "masonry"},
      {"indices": [0, 2, 3], "material": "masonry"}
    ],
    "materials": {
      "masonry": {
        "absorption": [0.03, 0.05, 0.07],
        "scattering": 0.1,
        "transmission": [0.0, 0.0, 0.0]
      }
    }
  },
  "simulation": {
    "direct": {
      "distance_attenuation": true,
      "occlusion": true,
      "occlusion_samples": 64
    },
    "reflections": {
      "enabled": true,
      "rays": 4096,
      "bounces": 2,
      "duration_s": 1.0
    },
    "pathing": {
      "enabled": true,
      "order": 2,
      "validation": true,
      "alternate_paths": true,
      "runtime_order": ["direct", "path", "reflections"]
    },
    "probe_volume": {
      "type": "box",
      "min_m": [-20, -85, 0.5],
      "max_m": [20, 155, 2.5],
      "spacing_m": 4.0
    },
    "probe_generation": {
      "type": "uniform_floor",
      "height_m": 1.5
    },
    "path_bake": {
      "identifier": "chicago-block-city-bake-v1",
      "required_call": "iplPathBakerBake",
      "probe_batch_serialization": "required",
      "fresh_process_reload": true,
      "bake_order": 2
    }
  },
  "expected": {
    "properties": [
      "The 85 m route takes about 60.7 s at 1.4 m/s: it approaches northbound along the east sidewalk, passes the Rowe Building storefront source, then turns west around the building's northeast corner so its masonry face produces an audible occlusion transition.",
      "The storefront source is approximately 1 m east of the Rowe Building's compiled east face at local ENU [12.5, -12.0, 1.5].",
      "The static Tom's Diner stem remains non-silent throughout the deterministic offline capture."
    ],
    "non_claims": [
      "The route is an acoustic demonstration in local ENU, not a surveyed pedestrian-accessibility route.",
      "This fixture makes no delivered-ear-SPL claim without output calibration.",
      "The listener forward vector remains north-facing through the westbound segment; orientation animation is outside this slice."
    ]
  }
}
