{
  "schema_version": "fightbox.fixture.s6a.v1",
  "fixture_id": "chicago-assumed-height-occlusion",
  "gate": "S5",
  "coordinate_frame": {
    "name": "local_enu",
    "units": "meters_seconds",
    "axes": "x_east_y_north_z_up",
    "steam_audio_mapping": "steam_x=enu_x;steam_y=enu_z;steam_z=-enu_y"
  },
  "kernel": {
    "name": "Steam Audio",
    "version": "4.8.1"
  },
  "sources": [
    {
      "id": "metamorphic-pink",
      "asset_id": "s3-calibrated-pink",
      "reference_level": {
        "mode": "SplAtOneMeter",
        "db_spl": 85
      },
      "position_m": [16, -68, 1.5]
    }
  ],
  "listener": {
    "trajectory": {
      "waypoints_m": [
        [-10, -68, 1.5],
        [16, -42, 1.5]
      ],
      "speed_mps": 1.4,
      "max_speed_mps": 2.0
    },
    "forward_enu": [0, 1, 0],
    "up_enu": [0, 0, 1]
  },
  "geometry": {
    "vertices_m": [
      [-20, -85, 0],
      [20, -85, 0],
      [20, 155, 0],
      [-20, 155, 0]
    ],
    "triangles": [
      {"indices": [0, 1, 2], "material": "masonry"},
      {"indices": [0, 2, 3], "material": "masonry"}
    ],
    "materials": {
      "masonry": {
        "absorption": [0.03, 0.05, 0.07],
        "scattering": 0.1,
        "transmission": [0.0, 0.0, 0.0]
      }
    }
  },
  "simulation": {
    "direct": {
      "distance_attenuation": true,
      "occlusion": true,
      "occlusion_samples": 64
    },
    "reflections": {
      "enabled": true,
      "rays": 4096,
      "bounces": 2,
      "duration_s": 1.0
    },
    "pathing": {
      "enabled": true,
      "order": 2,
      "validation": true,
      "alternate_paths": true,
      "runtime_order": ["direct", "path", "reflections"]
    },
    "probe_volume": {
      "type": "box",
      "min_m": [-20, -85, 0.5],
      "max_m": [20, 155, 2.5],
      "spacing_m": 4.0
    },
    "probe_generation": {
      "type": "uniform_floor",
      "height_m": 1.5
    },
    "path_bake": {
      "identifier": "chicago-assumed-height-metamorphic-v1",
      "required_call": "iplPathBakerBake",
      "probe_batch_serialization": "required",
      "fresh_process_reload": true,
      "bake_order": 2
    }
  },
  "expected": {
    "properties": [
      "The source-to-shadow segment crosses only way/843220032 at pedestrian ear height.",
      "The source-to-LOS segment stays east of every building footprint.",
      "The LOS RMS level exceeds the shadow RMS level at every clamped assumed-height variant."
    ],
    "non_claims": [
      "This fixture makes no delivered-ear-SPL claim without output calibration.",
      "The two listener waypoints declare separately rendered static percept positions; motion between them is not rendered."
    ]
  }
}
